Drowning Incident reported in Rural,INCIDENT,10-47 - Drowning Incident,Reported drowning incident at location. Additional details unknown.,37.52846985,-122.33560316,,,,50 ft,YES,YES,"37.52846985, -122.33560316",Rural,10-47,INC613,Medium
Underage Drinking reported in Suburban,INCIDENT,10-29 - Underage Drinking,Reported underage drinking at location. Additional details unknown.,37.53433665,-122.33024938,,,,50 ft,YES,YES,"37.53433665, -122.33024938",Suburban,10-29,INC614,High
Gas Leak reported in Suburban,INCIDENT,10-08 - Gas Leak,Reported gas leak at location. Additional details unknown.,37.52847171,-122.33225449,,,,50 ft,YES,YES,"37.52847171, -122.33225449",Suburban,10-08,INC615,High
Radiation Alert reported in Downtown,INCIDENT,10-36 - Radiation Alert,Reported radiation alert at location. Additional details unknown.,37.52935992,-122.33927099,,,,50 ft,YES,YES,"37.52935992, -122.33927099",Downtown,10-36,INC616,Low
Request for Backup reported in Rural,INCIDENT,10-01 - Request for Backup,Reported request for backup at location. Additional details unknown.,37.53539272,-122.33483349,,,,50 ft,YES,YES,"37.53539272, -122.33483349",Rural,10-01,INC617,Low
Unattended Luggage reported in Uptown,INCIDENT,10-26 - Unattended Luggage,Reported unattended luggage at location. Additional details unknown.,37.53276831,-122.33413515,,,,50 ft,YES,YES,"37.53276831, -122.33413515",Uptown,10-26,INC618,Medium
Vehicle Pursuit reported in Central,INCIDENT,10-22 - Vehicle Pursuit,Reported vehicle pursuit at location. Additional details unknown.,37.52330428,-122.33131551,,,,50 ft,YES,YES,"37.52330428, -122.33131551",Central,10-22,INC619,Low
Armed Robbery reported in Downtown,INCIDENT,10-03 - Armed Robbery,Reported armed robbery at location. Additional details unknown.,37.53295036,-122.32177478,,,,50 ft,YES,YES,"37.53295036, -122.32177478",Downtown,10-03,INC620,Critical
Unattended Luggage reported in Suburban,INCIDENT,10-26 - Unattended Luggage,Reported unattended luggage at location. Additional details unknown.,37.53455153,-122.33210113,,,,50 ft,YES,YES,"37.53455153, -122.33210113",Suburban,10-26,INC621,Low
Public Intoxication reported in Central,INCIDENT,10-25 - Public Intoxication,Reported public intoxication at location. Additional details unknown.,37.52532595,-122.33741764,,,,50 ft,YES,YES,"37.52532595, -122.33741764",Central,10-25,INC622,Low
Boating Accident reported in Seaside,INCIDENT,10-34 - Boating Accident,Reported boating accident at location. Additional details unknown.,37.52121184,-122.33701028,,,,50 ft,YES,YES,"37.52121184, -122.33701028",Seaside,10-34,INC623,Low
Cyber Crime reported in Industrial,INCIDENT,10-32 - Cyber Crime,Reported cyber crime at location. Additional details unknown.,37.53486135,-122.32214872,,,,50 ft,YES,YES,"37.53486135, -122.32214872",Industrial,10-32,INC624,Medium
Request for Backup reported in Industrial,INCIDENT,10-01 - Request for Backup,Reported request for backup at location. Additional details unknown.,37.52738307,-122.33423948,,,,50 ft,YES,YES,"37.52738307, -122.33423948",Industrial,10-01,INC625,High
Traffic Stop - High Risk reported in Downtown,INCIDENT,10-04 - Traffic Stop - High Risk,Reported traffic stop - high risk at location. Additional details unknown.,37.52047753,-122.33899555,,,,50 ft,YES,YES,"37.52047753, -122.33899555",Downtown,10-04,INC626,High
Gas Leak reported in Uptown,INCIDENT,10-08 - Gas Leak,Reported gas leak at location. Additional details unknown.,37.52926086,-122.32416174,,,,50 ft,YES,YES,"37.52926086, -122.32416174",Uptown,10-08,INC627,Low
Illegal Dumping reported in Central,INCIDENT,10-24 - Illegal Dumping,Reported illegal dumping at location. Additional details unknown.,37.52549982,-122.330004,,,,50 ft,YES,YES,"37.52549982, -122.330004",Central,10-24,INC628,Low
Gas Leak reported in Suburban,INCIDENT,10-08 - Gas Leak,Reported gas leak at location. Additional details unknown.,37.53381459,-122.32307578,,,,50 ft,YES,YES,"37.53381459, -122.32307578",Suburban,10-08,INC629,Critical
Medical Emergency - Critical reported in Suburban,INCIDENT,10-09 - Medical Emergency - Critical,Reported medical emergency - critical at location. Additional details unknown.,37.53591153,-122.32131233,,,,50 ft,YES,YES,"37.53591153, -122.32131233",Suburban,10-09,INC630,High
Illegal Dumping reported in Suburban,INCIDENT,10-24 - Illegal Dumping,Reported illegal dumping at location. Additional details unknown.,37.53660465,-122.33756473,,,,50 ft,YES,YES,"37.53660465, -122.33756473",Suburban,10-24,INC631,Critical
Drug Activity Reported reported in Uptown,INCIDENT,10-11 - Drug Activity Reported,Reported drug activity reported at location. Additional details unknown.,37.52876391,-122.3267308,,,,50 ft,YES,YES,"37.52876391, -122.3267308",Uptown,10-11,INC632,Medium
Drug Activity Reported reported in Rural,INCIDENT,10-11 - Drug Activity Reported,Reported drug activity reported at location. Additional details unknown.,37.53222287,-122.32421366,,,,50 ft,YES,YES,"37.53222287, -122.32421366",Rural,10-11,INC633,Medium
Riot or Large Protest reported in Industrial,INCIDENT,10-33 - Riot or Large Protest,Reported riot or large protest at location. Additional details unknown.,37.53334145,-122.32029939,,,,50 ft,YES,YES,"37.53334145, -122.32029939",Industrial,10-33,INC634,High
Burglary in Progress reported in Industrial,INCIDENT,10-02 - Burglary in Progress,Reported burglary in progress at location. Additional details unknown.,37.53676152,-122.33586786,,,,50 ft,YES,YES,"37.53676152, -122.33586786",Industrial,10-02,INC635,Medium
Burglary in Progress reported in Downtown,INCIDENT,10-02 - Burglary in Progress,Reported burglary in progress at location. Additional details unknown.,37.53528053,-122.33077754,,,,50 ft,YES,YES,"37.53528053, -122.33077754",Downtown,10-02,INC636,Low
Illegal Dumping reported in Downtown,INCIDENT,10-24 - Illegal Dumping,Reported illegal dumping at location. Additional details unknown.,37.53122378,-122.32805305,,,,50 ft,YES,YES,"37.53122378, -122.32805305",Downtown,10-24,INC637,High
Vehicle Breakdown reported in Seaside,INCIDENT,10-50 - Vehicle Breakdown,Reported vehicle breakdown at location. Additional details unknown.,37.53712826,-122.33117922,,,,50 ft,YES,YES,"37.53712826, -122.33117922",Seaside,10-50,INC638,High
Hit-and-Run Accident reported in Uptown,INCIDENT,10-23 - Hit-and-Run Accident,Reported hit-and-run accident at location. Additional details unknown.,37.53658352,-122.32705925,,,,50 ft,YES,YES,"37.53658352, -122.32705925",Uptown,10-23,INC639,Critical
Bridge Collapse reported in Suburban,INCIDENT,10-37 - Bridge Collapse,Reported bridge collapse at location. Additional details unknown.,37.52302827,-122.3265885,,,,50 ft,YES,YES,"37.52302827, -122.3265885",Suburban,10-37,INC640,Low
Suspicious Package reported in Central,INCIDENT,10-12 - Suspicious Package,Reported suspicious package at location. Additional details unknown.,37.52459707,-122.32554369,,,,50 ft,YES,YES,"37.52459707, -122.32554369",Central,10-12,INC641,Low
Riot or Large Protest reported in Downtown,INCIDENT,10-33 - Riot or Large Protest,Reported riot or large protest at location. Additional details unknown.,37.52697582,-122.32876817,,,,50 ft,YES,YES,"37.52697582, -122.32876817",Downtown,10-33,INC642,Critical
Avalanche Risk reported in Central,INCIDENT,10-41 - Avalanche Risk,Reported avalanche risk at location. Additional details unknown.,37.53464359,-122.32366552,,,,50 ft,YES,YES,"37.53464359, -122.32366552",Central,10-41,INC643,Medium
Earthquake Damage reported in Seaside,INCIDENT,10-45 - Earthquake Damage,Reported earthquake damage at location. Additional details unknown.,37.53614355,-122.32506249,,,,50 ft,YES,YES,"37.53614355, -122.32506249",Seaside,10-45,INC644,Critical
Road Hazard reported in Central,INCIDENT,10-21 - Road Hazard,Reported road hazard at location. Additional details unknown.,37.52696238,-122.33384541,,,,50 ft,YES,YES,"37.52696238, -122.33384541",Central,10-21,INC645,Low
Mudslide Reported reported in Seaside,INCIDENT,10-38 - Mudslide Reported,Reported mudslide reported at location. Additional details unknown.,37.53551697,-122.32888721,,,,50 ft,YES,YES,"37.53551697, -122.32888721",Seaside,10-38,INC646,Critical
Public Intoxication reported in Industrial,INCIDENT,10-25 - Public Intoxication,Reported public intoxication at location. Additional details unknown.,37.52823757,-122.33134859,,,,50 ft,YES,YES,"37.52823757, -122.33134859",Industrial,10-25,INC647,Low
Boating Accident reported in Industrial,INCIDENT,10-34 - Boating Accident,Reported boating accident at location. Additional details unknown.,37.52841401,-122.32199829,,,,50 ft,YES,YES,"37.52841401, -122.32199829",Industrial,10-34,INC648,Critical
Earthquake Damage reported in Central,INCIDENT,10-45 - Earthquake Damage,Reported earthquake damage at location. Additional details unknown.,37.52155445,-122.3287549,,,,50 ft,YES,YES,"37.52155445, -122.3287549",Central,10-45,INC649,Critical
Structure Fire reported in Central,INCIDENT,10-07 - Structure Fire,Reported structure fire at location. Additional details unknown.,37.52994353,-122.32555654,,,,50 ft,YES,YES,"37.52994353, -122.32555654",Central,10-07,INC650,High
Landslide Reported reported in Downtown,INCIDENT,10-42 - Landslide Reported,Reported landslide reported at location. Additional details unknown.,37.53150406,-122.3256854,,,,50 ft,YES,YES,"37.53150406, -122.3256854",Downtown,10-42,INC651,Critical
Hit-and-Run Accident reported in Downtown,INCIDENT,10-23 - Hit-and-Run Accident,Reported hit-and-run accident at location. Additional details unknown.,37.53617788,-122.33625991,,,,50 ft,YES,YES,"37.53617788, -122.33625991",Downtown,10-23,INC652,High
Request for Backup reported in Central,INCIDENT,10-01 - Request for Backup,Reported request for backup at location. Additional details unknown.,37.53275565,-122.3239463,,,,50 ft,YES,YES,"37.53275565, -122.3239463",Central,10-01,INC653,Low
Traffic Stop - High Risk reported in Downtown,INCIDENT,10-04 - Traffic Stop - High Risk,Reported traffic stop - high risk at location. Additional details unknown.,37.52268684,-122.33749401,,,,50 ft,YES,YES,"37.52268684, -122.33749401",Downtown,10-04,INC654,Critical
Trespassing Reported reported in Uptown,INCIDENT,10-16 - Trespassing Reported,Reported trespassing reported at location. Additional details unknown.,37.52029908,-122.33791142,,,,50 ft,YES,YES,"37.52029908, -122.33791142",Uptown,10-16,INC655,High
Vehicle Pursuit reported in Industrial,INCIDENT,10-22 - Vehicle Pursuit,Reported vehicle pursuit at location. Additional details unknown.,37.53845065,-122.3264138,,,,50 ft,YES,YES,"37.53845065, -122.3264138",Industrial,10-22,INC656,High
Hostage Situation reported in Seaside,INCIDENT,10-05 - Hostage Situation,Reported hostage situation at location. Additional details unknown.,37.52310301,-122.33121406,,,,50 ft,YES,YES,"37.52310301, -122.33121406",Seaside,10-05,INC657,High
Noise Complaint reported in Uptown,INCIDENT,10-28 - Noise Complaint,Reported noise complaint at location. Additional details unknown.,37.52611477,-122.32627832,,,,50 ft,YES,YES,"37.52611477, -122.32627832",Uptown,10-28,INC658,Medium
Sinkhole Formation reported in Industrial,INCIDENT,10-44 - Sinkhole Formation,Reported sinkhole formation at location. Additional details unknown.,37.52452868,-122.32566585,,,,50 ft,YES,YES,"37.52452868, -122.32566585",Industrial,10-44,INC659,Medium
Public Disturbance reported in Central,INCIDENT,10-18 - Public Disturbance,Reported public disturbance at location. Additional details unknown.,37.52828328,-122.32470117,,,,50 ft,YES,YES,"37.52828328, -122.32470117",Central,10-18,INC660,High
Collapsed Building reported in Suburban,INCIDENT,10-48 - Collapsed Building,Reported collapsed building at location. Additional details unknown.,37.52013607,-122.32914412,,,,50 ft,YES,YES,"37.52013607, -122.32914412",Suburban,10-48,INC661,Low
Public Intoxication reported in Industrial,INCIDENT,10-25 - Public Intoxication,Reported public intoxication at location. Additional details unknown.,37.52056576,-122.3324989,,,,50 ft,YES,YES,"37.52056576, -122.3324989",Industrial,10-25,INC662,Low
Boating Accident reported in Suburban,INCIDENT,10-34 - Boating Accident,Reported boating accident at location. Additional details unknown.,37.52583524,-122.32677944,,,,50 ft,YES,YES,"37.52583524, -122.32677944",Suburban,10-34,INC663,Critical
Chemical Spill reported in Downtown,INCIDENT,10-35 - Chemical Spill,Reported chemical spill at location. Additional details unknown.,37.53216767,-122.32395103,,,,50 ft,YES,YES,"37.53216767, -122.32395103",Downtown,10-35,INC664,High
Burglary in Progress reported in Industrial,INCIDENT,10-02 - Burglary in Progress,Reported burglary in progress at location. Additional details unknown.,37.52016546,-122.32782752,,,,50 ft,YES,YES,"37.52016546, -122.32782752",Industrial,10-02,INC665,Medium
Cyber Crime reported in Downtown,INCIDENT,10-32 - Cyber Crime,Reported cyber crime at location. Additional details unknown.,37.53700286,-122.33077337,,,,50 ft,YES,YES,"37.53700286, -122.33077337",Downtown,10-32,INC666,Critical
Lost Child reported in Industrial,INCIDENT,10-30 - Lost Child,Reported lost child at location. Additional details unknown.,37.52659461,-122.3318951,,,,50 ft,YES,YES,"37.52659461, -122.3318951",Industrial,10-30,INC667,Critical
Vehicle Breakdown reported in Rural,INCIDENT,10-50 - Vehicle Breakdown,Reported vehicle breakdown at location. Additional details unknown.,37.53916005,-122.32603136,,,,50 ft,YES,YES,"37.53916005, -122.32603136",Rural,10-50,INC668,Medium
Burglary in Progress reported in Rural,INCIDENT,10-02 - Burglary in Progress,Reported burglary in progress at location. Additional details unknown.,37.52575672,-122.33891003,,,,50 ft,YES,YES,"37.52575672, -122.33891003",Rural,10-02,INC669,Low
Hostage Situation reported in Industrial,INCIDENT,10-05 - Hostage Situation,Reported hostage situation at location. Additional details unknown.,37.52339413,-122.33220126,,,,50 ft,YES,YES,"37.52339413, -122.33220126",Industrial,10-05,INC670,High
Traffic Stop - High Risk reported in Seaside,INCIDENT,10-04 - Traffic Stop - High Risk,Reported traffic stop - high risk at location. Additional details unknown.,37.53490465,-122.33711409,,,,50 ft,YES,YES,"37.53490465, -122.33711409",Seaside,10-04,INC671,Medium
Radiation Alert reported in Seaside,INCIDENT,10-36 - Radiation Alert,Reported radiation alert at location. Additional details unknown.,37.52511668,-122.32659326,,,,50 ft,YES,YES,"37.52511668, -122.32659326",Seaside,10-36,INC672,Medium
Gas Leak reported in Central,INCIDENT,10-08 - Gas Leak,Reported gas leak at location. Additional details unknown.,37.53683109,-122.33277019,,,,50 ft,YES,YES,"37.53683109, -122.33277019",Central,10-08,INC673,Critical
Severe Weather Alert reported in Rural,INCIDENT,10-43 - Severe Weather Alert,Reported severe weather alert at location. Additional details unknown.,37.53392069,-122.33483221,,,,50 ft,YES,YES,"37.53392069, -122.33483221",Rural,10-43,INC674,Low
Trespassing Reported reported in Industrial,INCIDENT,10-16 - Trespassing Reported,Reported trespassing reported at location. Additional details unknown.,37.53038166,-122.32105125,,,,50 ft,YES,YES,"37.53038166, -122.32105125",Industrial,10-16,INC675,High
Drug Activity Reported reported in Suburban,INCIDENT,10-11 - Drug Activity Reported,Reported drug activity reported at location. Additional details unknown.,37.52376031,-122.33054319,,,,50 ft,YES,YES,"37.52376031, -122.33054319",Suburban,10-11,INC676,Low
Avalanche Risk reported in Downtown,INCIDENT,10-41 - Avalanche Risk,Reported avalanche risk at location. Additional details unknown.,37.52498611,-122.33029936,,,,50 ft,YES,YES,"37.52498611, -122.33029936",Downtown,10-41,INC677,Critical
Unattended Luggage reported in Industrial,INCIDENT,10-26 - Unattended Luggage,Reported unattended luggage at location. Additional details unknown.,37.53660959,-122.3361712,,,,50 ft,YES,YES,"37.53660959, -122.3361712",Industrial,10-26,INC678,Low
Animal Attack reported in Seaside,INCIDENT,10-20 - Animal Attack,Reported animal attack at location. Additional details unknown.,37.52725652,-122.33545143,,,,50 ft,YES,YES,"37.52725652, -122.33545143",Seaside,10-20,INC679,High
Drug Activity Reported reported in Suburban,INCIDENT,10-11 - Drug Activity Reported,Reported drug activity reported at location. Additional details unknown.,37.52627768,-122.33875842,,,,50 ft,YES,YES,"37.52627768, -122.33875842",Suburban,10-11,INC680,Critical
Gunshots Heard reported in Central,INCIDENT,10-13 - Gunshots Heard,Reported gunshots heard at location. Additional details unknown.,37.52004404,-122.32729705,,,,50 ft,YES,YES,"37.52004404, -122.32729705",Central,10-13,INC681,High
Explosion Reported reported in Rural,INCIDENT,10-06 - Explosion Reported,Reported explosion reported at location. Additional details unknown.,37.52170634,-122.32426993,,,,50 ft,YES,YES,"37.52170634, -122.32426993",Rural,10-06,INC682,Low
Boating Accident reported in Seaside,INCIDENT,10-34 - Boating Accident,Reported boating accident at location. Additional details unknown.,37.52755864,-122.33395969,,,,50 ft,YES,YES,"37.52755864, -122.33395969",Seaside,10-34,INC683,High
Gunshots Heard reported in Seaside,INCIDENT,10-13 - Gunshots Heard,Reported gunshots heard at location. Additional details unknown.,37.52421648,-122.32940138,,,,50 ft,YES,YES,"37.52421648, -122.32940138",Seaside,10-13,INC684,Low
Earthquake Damage reported in Downtown,INCIDENT,10-45 - Earthquake Damage,Reported earthquake damage at location. Additional details unknown.,37.53057446,-122.33261697,,,,50 ft,YES,YES,"37.53057446, -122.33261697",Downtown,10-45,INC685,Medium
Medical Emergency - Minor reported in Suburban,INCIDENT,10-10 - Medical Emergency - Minor,Reported medical emergency - minor at location. Additional details unknown.,37.52377789,-122.32614876,,,,50 ft,YES,YES,"37.52377789, -122.32614876",Suburban,10-10,INC686,Critical
Chemical Spill reported in Seaside,INCIDENT,10-35 - Chemical Spill,Reported chemical spill at location. Additional details unknown.,37.52267205,-122.32280223,,,,50 ft,YES,YES,"37.52267205, -122.32280223",Seaside,10-35,INC687,Low
Severe Weather Alert reported in Industrial,INCIDENT,10-43 - Severe Weather Alert,Reported severe weather alert at location. Additional details unknown.,37.52410976,-122.32585135,,,,50 ft,YES,YES,"37.52410976, -122.32585135",Industrial,10-43,INC688,Low
Cyber Crime reported in Central,INCIDENT,10-32 - Cyber Crime,Reported cyber crime at location. Additional details unknown.,37.52478973,-122.33436613,,,,50 ft,YES,YES,"37.52478973, -122.33436613",Central,10-32,INC689,Critical
Sinkhole Formation reported in Central,INCIDENT,10-44 - Sinkhole Formation,Reported sinkhole formation at location. Additional details unknown.,37.52724946,-122.32830966,,,,50 ft,YES,YES,"37.52724946, -122.32830966",Central,10-44,INC690,Medium
Underage Drinking reported in Uptown,INCIDENT,10-29 - Underage Drinking,Reported underage drinking at location. Additional details unknown.,37.52784235,-122.32103657,,,,50 ft,YES,YES,"37.52784235, -122.32103657",Uptown,10-29,INC691,Low
Road Hazard reported in Rural,INCIDENT,10-21 - Road Hazard,Reported road hazard at location. Additional details unknown.,37.53987531,-122.32414109,,,,50 ft,YES,YES,"37.53987531, -122.32414109",Rural,10-21,INC692,Critical
Public Intoxication reported in Seaside,INCIDENT,10-25 - Public Intoxication,Reported public intoxication at location. Additional details unknown.,37.52194767,-122.33348926,,,,50 ft,YES,YES,"37.52194767, -122.33348926",Seaside,10-25,INC693,Low
Lost Child reported in Central,INCIDENT,10-30 - Lost Child,Reported lost child at location. Additional details unknown.,37.53178333,-122.33419346,,,,50 ft,YES,YES,"37.53178333, -122.33419346",Central,10-30,INC694,Medium
Trespassing Reported reported in Downtown,INCIDENT,10-16 - Trespassing Reported,Reported trespassing reported at location. Additional details unknown.,37.53269628,-122.32072181,,,,50 ft,YES,YES,"37.53269628, -122.32072181",Downtown,10-16,INC695,Medium
Explosion Reported reported in Downtown,INCIDENT,10-06 - Explosion Reported,Reported explosion reported at location. Additional details unknown.,37.53865617,-122.32377989,,,,50 ft,YES,YES,"37.53865617, -122.32377989",Downtown,10-06,INC696,Medium
Radiation Alert reported in Downtown,INCIDENT,10-36 - Radiation Alert,Reported radiation alert at location. Additional details unknown.,37.53696375,-122.32311473,,,,50 ft,YES,YES,"37.53696375, -122.32311473",Downtown,10-36,INC697,High
Street Racing Incident reported in Rural,INCIDENT,10-17 - Street Racing Incident,Reported street racing incident at location. Additional details unknown.,37.52392789,-122.33299998,,,,50 ft,YES,YES,"37.52392789, -122.33299998",Rural,10-17,INC698,Critical
Hit-and-Run Accident reported in Suburban,INCIDENT,10-23 - Hit-and-Run Accident,Reported hit-and-run accident at location. Additional details unknown.,37.53496914,-122.33780061,,,,50 ft,YES,YES,"37.53496914, -122.33780061",Suburban,10-23,INC699,Low
Radiation Alert reported in Downtown,INCIDENT,10-36 - Radiation Alert,Reported radiation alert at location. Additional details unknown.,37.53626166,-122.33755277,,,,50 ft,YES,YES,"37.53626166, -122.33755277",Downtown,10-36,INC700,High
Earthquake Damage reported in Rural,INCIDENT,10-45 - Earthquake Damage,Reported earthquake damage at location. Additional details unknown.,37.52389552,-122.33472475,,,,50 ft,YES,YES,"37.52389552, -122.33472475",Rural,10-45,INC701,High
Armed Robbery reported in Suburban,INCIDENT,10-03 - Armed Robbery,Reported armed robbery at location. Additional details unknown.,37.52700996,-122.33927851,,,,50 ft,YES,YES,"37.52700996, -122.33927851",Suburban,10-03,INC702,Critical
Burglary in Progress reported in Downtown,INCIDENT,10-02 - Burglary in Progress,Reported burglary in progress at location. Additional details unknown.,37.52488716,-122.33911545,,,,50 ft,YES,YES,"37.52488716, -122.33911545",Downtown,10-02,INC703,High
Attempted Suicide reported in Industrial,INCIDENT,10-31 - Attempted Suicide,Reported attempted suicide at location. Additional details unknown.,37.5296118,-122.3367417,,,,50 ft,YES,YES,"37.5296118, -122.3367417",Industrial,10-31,INC704,Medium
Gunshots Heard reported in Rural,INCIDENT,10-13 - Gunshots Heard,Reported gunshots heard at location. Additional details unknown.,37.52062244,-122.32047851,,,,50 ft,YES,YES,"37.52062244, -122.32047851",Rural,10-13,INC705,Critical
Domestic Dispute reported in Rural,INCIDENT,10-19 - Domestic Dispute,Reported domestic dispute at location. Additional details unknown.,37.53832069,-122.32906613,,,,50 ft,YES,YES,"37.53832069, -122.32906613",Rural,10-19,INC706,Critical
Chemical Spill reported in Downtown,INCIDENT,10-35 - Chemical Spill,Reported chemical spill at location. Additional details unknown.,37.52345358,-122.33098896,,,,50 ft,YES,YES,"37.52345358, -122.33098896",Downtown,10-35,INC707,Low
Traffic Stop - High Risk reported in Downtown,INCIDENT,10-04 - Traffic Stop - High Risk,Reported traffic stop - high risk at location. Additional details unknown.,37.52347569,-122.33655709,,,,50 ft,YES,YES,"37.52347569, -122.33655709",Downtown,10-04,INC708,High
Flooding Reported reported in Uptown,INCIDENT,10-40 - Flooding Reported,Reported flooding reported at location. Additional details unknown.,37.53104392,-122.33489584,,,,50 ft,YES,YES,"37.53104392, -122.33489584",Uptown,10-40,INC709,Low
Elevator Rescue Required reported in Suburban,INCIDENT,10-49 - Elevator Rescue Required,Reported elevator rescue required at location. Additional details unknown.,37.52770407,-122.32738263,,,,50 ft,YES,YES,"37.52770407, -122.32738263",Suburban,10-49,INC710,Low
Bridge Collapse reported in Downtown,INCIDENT,10-37 - Bridge Collapse,Reported bridge collapse at location. Additional details unknown.,37.53930774,-122.33054456,,,,50 ft,YES,YES,"37.53930774, -122.33054456",Downtown,10-37,INC711,Low
Noise Complaint reported in Seaside,INCIDENT,10-28 - Noise Complaint,Reported noise complaint at location. Additional details unknown.,37.52442758,-122.32687061,,,,50 ft,YES,YES,"37.52442758, -122.32687061",Seaside,10-28,INC712,Critical
Radiation Alert reported in Uptown,INCIDENT,10-36 - Radiation Alert,Reported radiation alert at location. Additional details unknown.,37.52865288,-122.32327945,,,,50 ft,YES,YES,"37.52865288, -122.32327945",Uptown,10-36,INC713,Medium
Collapsed Building reported in Seaside,INCIDENT,10-48 - Collapsed Building,Reported collapsed building at location. Additional details unknown.,37.52953262,-122.33602344,,,,50 ft,YES,YES,"37.52953262, -122.33602344",Seaside,10-48,INC714,Medium
Medical Emergency - Minor reported in Seaside,INCIDENT,10-10 - Medical Emergency - Minor,Reported medical emergency - minor at location. Additional details unknown.,37.52932512,-122.32008883,,,,50 ft,YES,YES,"37.52932512, -122.32008883",Seaside,10-10,INC715,Low
Drug Activity Reported reported in Downtown,INCIDENT,10-11 - Drug Activity Reported,Reported drug activity reported at location. Additional details unknown.,37.5295866,-122.33798873,,,,50 ft,YES,YES,"37.5295866, -122.33798873",Downtown,10-11,INC716,High
Public Disturbance reported in Rural,INCIDENT,10-18 - Public Disturbance,Reported public disturbance at location. Additional details unknown.,37.53517538,-122.33996963,,,,50 ft,YES,YES,"37.53517538, -122.33996963",Rural,10-18,INC717,Medium
Vehicle Pursuit reported in Central,INCIDENT,10-22 - Vehicle Pursuit,Reported vehicle pursuit at location. Additional details unknown.,37.53288396,-122.33399141,,,,50 ft,YES,YES,"37.53288396, -122.33399141",Central,10-22,INC718,Medium
Hit-and-Run Accident reported in Seaside,INCIDENT,10-23 - Hit-and-Run Accident,Reported hit-and-run accident at location. Additional details unknown.,37.52977888,-122.32478712,,,,50 ft,YES,YES,"37.52977888, -122.32478712",Seaside,10-23,INC719,High
