Tornado Warning reported in Seaside,INCIDENT,10-39 - Tornado Warning,Reported tornado warning at location. Additional details unknown.,37.5226418,-122.32755474,,,,50 ft,YES,YES,"37.5226418, -122.32755474",Seaside,10-39,INC827,Medium
Tornado Warning reported in Industrial,INCIDENT,10-39 - Tornado Warning,Reported tornado warning at location. Additional details unknown.,37.53655893,-122.32376371,,,,50 ft,YES,YES,"37.53655893, -122.32376371",Industrial,10-39,INC828,High
Severe Weather Alert reported in Suburban,INCIDENT,10-43 - Severe Weather Alert,Reported severe weather alert at location. Additional details unknown.,37.52617324,-122.33119048,,,,50 ft,YES,YES,"37.52617324, -122.33119048",Suburban,10-43,INC829,High
Drug Activity Reported reported in Suburban,INCIDENT,10-11 - Drug Activity Reported,Reported drug activity reported at location. Additional details unknown.,37.53233016,-122.33743312,,,,50 ft,YES,YES,"37.53233016, -122.33743312",Suburban,10-11,INC830,Low
Collapsed Building reported in Central,INCIDENT,10-48 - Collapsed Building,Reported collapsed building at location. Additional details unknown.,37.5337207,-122.33241475,,,,50 ft,YES,YES,"37.5337207, -122.33241475",Central,10-48,INC831,Medium
Landslide Reported reported in Downtown,INCIDENT,10-42 - Landslide Reported,Reported landslide reported at location. Additional details unknown.,37.52887885,-122.33646432,,,,50 ft,YES,YES,"37.52887885, -122.33646432",Downtown,10-42,INC832,Critical
Burglary in Progress reported in Seaside,INCIDENT,10-02 - Burglary in Progress,Reported burglary in progress at location. Additional details unknown.,37.53424949,-122.32223389,,,,50 ft,YES,YES,"37.53424949, -122.32223389",Seaside,10-02,INC833,High
Wildfire Spotted reported in Uptown,INCIDENT,10-46 - Wildfire Spotted,Reported wildfire spotted at location. Additional details unknown.,37.53108179,-122.32833271,,,,50 ft,YES,YES,"37.53108179, -122.32833271",Uptown,10-46,INC834,Medium
Armed Robbery reported in Seaside,INCIDENT,10-03 - Armed Robbery,Reported armed robbery at location. Additional details unknown.,37.53909772,-122.32218089,,,,50 ft,YES,YES,"37.53909772, -122.32218089",Seaside,10-03,INC835,Critical
Animal Attack reported in Rural,INCIDENT,10-20 - Animal Attack,Reported animal attack at location. Additional details unknown.,37.53617396,-122.32386462,,,,50 ft,YES,YES,"37.53617396, -122.32386462",Rural,10-20,INC836,Critical
Domestic Dispute reported in Downtown,INCIDENT,10-19 - Domestic Dispute,Reported domestic dispute at location. Additional details unknown.,37.53960648,-122.32226357,,,,50 ft,YES,YES,"37.53960648, -122.32226357",Downtown,10-19,INC837,Medium
Hit-and-Run Accident reported in Uptown,INCIDENT,10-23 - Hit-and-Run Accident,Reported hit-and-run accident at location. Additional details unknown.,37.5221513,-122.33601347,,,,50 ft,YES,YES,"37.5221513, -122.33601347",Uptown,10-23,INC838,High
Armed Robbery reported in Rural,INCIDENT,10-03 - Armed Robbery,Reported armed robbery at location. Additional details unknown.,37.52028449,-122.32437842,,,,50 ft,YES,YES,"37.52028449, -122.32437842",Rural,10-03,INC839,High
Attempted Suicide reported in Central,INCIDENT,10-31 - Attempted Suicide,Reported attempted suicide at location. Additional details unknown.,37.52349548,-122.33407106,,,,50 ft,YES,YES,"37.52349548, -122.33407106",Central,10-31,INC840,Critical
Armed Robbery reported in Downtown,INCIDENT,10-03 - Armed Robbery,Reported armed robbery at location. Additional details unknown.,37.5381712,-122.33817183,,,,50 ft,YES,YES,"37.5381712, -122.33817183",Downtown,10-03,INC841,Medium
Severe Weather Alert reported in Seaside,INCIDENT,10-43 - Severe Weather Alert,Reported severe weather alert at location. Additional details unknown.,37.53367908,-122.33671831,,,,50 ft,YES,YES,"37.53367908, -122.33671831",Seaside,10-43,INC842,Low
Vehicle Breakdown reported in Downtown,INCIDENT,10-50 - Vehicle Breakdown,Reported vehicle breakdown at location. Additional details unknown.,37.52447737,-122.3357155,,,,50 ft,YES,YES,"37.52447737, -122.3357155",Downtown,10-50,INC843,Medium
Explosion Reported reported in Rural,INCIDENT,10-06 - Explosion Reported,Reported explosion reported at location. Additional details unknown.,37.52755662,-122.32505598,,,,50 ft,YES,YES,"37.52755662, -122.32505598",Rural,10-06,INC844,Critical
Suspicious Package reported in Suburban,INCIDENT,10-12 - Suspicious Package,Reported suspicious package at location. Additional details unknown.,37.52110719,-122.33463705,,,,50 ft,YES,YES,"37.52110719, -122.33463705",Suburban,10-12,INC845,High
Burglary in Progress reported in Suburban,INCIDENT,10-02 - Burglary in Progress,Reported burglary in progress at location. Additional details unknown.,37.53320546,-122.33615704,,,,50 ft,YES,YES,"37.53320546, -122.33615704",Suburban,10-02,INC846,Medium
Boating Accident reported in Uptown,INCIDENT,10-34 - Boating Accident,Reported boating accident at location. Additional details unknown.,37.53597603,-122.33107871,,,,50 ft,YES,YES,"37.53597603, -122.33107871",Uptown,10-34,INC847,Low
Landslide Reported reported in Seaside,INCIDENT,10-42 - Landslide Reported,Reported landslide reported at location. Additional details unknown.,37.52840655,-122.32264409,,,,50 ft,YES,YES,"37.52840655, -122.32264409",Seaside,10-42,INC848,Critical
Vehicle Breakdown reported in Seaside,INCIDENT,10-50 - Vehicle Breakdown,Reported vehicle breakdown at location. Additional details unknown.,37.53998162,-122.32068596,,,,50 ft,YES,YES,"37.53998162, -122.32068596",Seaside,10-50,INC849,Critical
Lost Child reported in Industrial,INCIDENT,10-30 - Lost Child,Reported lost child at location. Additional details unknown.,37.52584195,-122.33653755,,,,50 ft,YES,YES,"37.52584195, -122.33653755",Industrial,10-30,INC850,High
Attempted Kidnapping reported in Suburban,INCIDENT,10-15 - Attempted Kidnapping,Reported attempted kidnapping at location. Additional details unknown.,37.52405777,-122.32138899,,,,50 ft,YES,YES,"37.52405777, -122.32138899",Suburban,10-15,INC851,Critical
Traffic Stop - High Risk reported in Suburban,INCIDENT,10-04 - Traffic Stop - High Risk,Reported traffic stop - high risk at location. Additional details unknown.,37.5381594,-122.32512312,,,,50 ft,YES,YES,"37.5381594, -122.32512312",Suburban,10-04,INC852,Medium
Cyber Crime reported in Downtown,INCIDENT,10-32 - Cyber Crime,Reported cyber crime at location. Additional details unknown.,37.52493652,-122.33565449,,,,50 ft,YES,YES,"37.52493652, -122.33565449",Downtown,10-32,INC853,Low
Sinkhole Formation reported in Central,INCIDENT,10-44 - Sinkhole Formation,Reported sinkhole formation at location. Additional details unknown.,37.525833,-122.32351835,,,,50 ft,YES,YES,"37.525833, -122.32351835",Central,10-44,INC854,High
Earthquake Damage reported in Downtown,INCIDENT,10-45 - Earthquake Damage,Reported earthquake damage at location. Additional details unknown.,37.52905466,-122.32947287,,,,50 ft,YES,YES,"37.52905466, -122.32947287",Downtown,10-45,INC855,Medium
Domestic Dispute reported in Downtown,INCIDENT,10-19 - Domestic Dispute,Reported domestic dispute at location. Additional details unknown.,37.52520174,-122.32667283,,,,50 ft,YES,YES,"37.52520174, -122.32667283",Downtown,10-19,INC856,Medium
Collapsed Building reported in Uptown,INCIDENT,10-48 - Collapsed Building,Reported collapsed building at location. Additional details unknown.,37.52173385,-122.33516362,,,,50 ft,YES,YES,"37.52173385, -122.33516362",Uptown,10-48,INC857,High
Burglary in Progress reported in Suburban,INCIDENT,10-02 - Burglary in Progress,Reported burglary in progress at location. Additional details unknown.,37.52837108,-122.33815072,,,,50 ft,YES,YES,"37.52837108, -122.33815072",Suburban,10-02,INC858,High
Medical Emergency - Critical reported in Rural,INCIDENT,10-09 - Medical Emergency - Critical,Reported medical emergency - critical at location. Additional details unknown.,37.53713539,-122.33760556,,,,50 ft,YES,YES,"37.53713539, -122.33760556",Rural,10-09,INC859,High
Unattended Luggage reported in Downtown,INCIDENT,10-26 - Unattended Luggage,Reported unattended luggage at location. Additional details unknown.,37.53391767,-122.32355748,,,,50 ft,YES,YES,"37.53391767, -122.32355748",Downtown,10-26,INC860,Medium
Collapsed Building reported in Rural,INCIDENT,10-48 - Collapsed Building,Reported collapsed building at location. Additional details unknown.,37.52075738,-122.3386065,,,,50 ft,YES,YES,"37.52075738, -122.3386065",Rural,10-48,INC861,Low
Attempted Kidnapping reported in Suburban,INCIDENT,10-15 - Attempted Kidnapping,Reported attempted kidnapping at location. Additional details unknown.,37.53184676,-122.32851646,,,,50 ft,YES,YES,"37.53184676, -122.32851646",Suburban,10-15,INC862,Critical
Street Racing Incident reported in Industrial,INCIDENT,10-17 - Street Racing Incident,Reported street racing incident at location. Additional details unknown.,37.52559155,-122.32376048,,,,50 ft,YES,YES,"37.52559155, -122.32376048",Industrial,10-17,INC863,Medium
Illegal Dumping reported in Suburban,INCIDENT,10-24 - Illegal Dumping,Reported illegal dumping at location. Additional details unknown.,37.52290189,-122.3366667,,,,50 ft,YES,YES,"37.52290189, -122.3366667",Suburban,10-24,INC864,Low
Tornado Warning reported in Suburban,INCIDENT,10-39 - Tornado Warning,Reported tornado warning at location. Additional details unknown.,37.52638843,-122.32374519,,,,50 ft,YES,YES,"37.52638843, -122.32374519",Suburban,10-39,INC865,High
Underage Drinking reported in Downtown,INCIDENT,10-29 - Underage Drinking,Reported underage drinking at location. Additional details unknown.,37.53263149,-122.32990776,,,,50 ft,YES,YES,"37.53263149, -122.32990776",Downtown,10-29,INC866,Critical
Request for Backup reported in Central,INCIDENT,10-01 - Request for Backup,Reported request for backup at location. Additional details unknown.,37.5292512,-122.32402039,,,,50 ft,YES,YES,"37.5292512, -122.32402039",Central,10-01,INC867,Medium
Gas Leak reported in Industrial,INCIDENT,10-08 - Gas Leak,Reported gas leak at location. Additional details unknown.,37.53237808,-122.33782908,,,,50 ft,YES,YES,"37.53237808, -122.33782908",Industrial,10-08,INC868,Medium
Earthquake Damage reported in Seaside,INCIDENT,10-45 - Earthquake Damage,Reported earthquake damage at location. Additional details unknown.,37.52920234,-122.33263272,,,,50 ft,YES,YES,"37.52920234, -122.33263272",Seaside,10-45,INC869,Critical
Public Disturbance reported in Downtown,INCIDENT,10-18 - Public Disturbance,Reported public disturbance at location. Additional details unknown.,37.53355973,-122.33981398,,,,50 ft,YES,YES,"37.53355973, -122.33981398",Downtown,10-18,INC870,Medium
Attempted Kidnapping reported in Central,INCIDENT,10-15 - Attempted Kidnapping,Reported attempted kidnapping at location. Additional details unknown.,37.5266958,-122.33270968,,,,50 ft,YES,YES,"37.5266958, -122.33270968",Central,10-15,INC871,Medium
Medical Emergency - Minor reported in Downtown,INCIDENT,10-10 - Medical Emergency - Minor,Reported medical emergency - minor at location. Additional details unknown.,37.52890209,-122.33114506,,,,50 ft,YES,YES,"37.52890209, -122.33114506",Downtown,10-10,INC872,Medium
Gas Leak reported in Industrial,INCIDENT,10-08 - Gas Leak,Reported gas leak at location. Additional details unknown.,37.5293308,-122.32542299,,,,50 ft,YES,YES,"37.5293308, -122.32542299",Industrial,10-08,INC873,Critical
Traffic Stop - High Risk reported in Uptown,INCIDENT,10-04 - Traffic Stop - High Risk,Reported traffic stop - high risk at location. Additional details unknown.,37.52007307,-122.33093225,,,,50 ft,YES,YES,"37.52007307, -122.33093225",Uptown,10-04,INC874,Low
Vehicle Breakdown reported in Industrial,INCIDENT,10-50 - Vehicle Breakdown,Reported vehicle breakdown at location. Additional details unknown.,37.53024267,-122.33012036,,,,50 ft,YES,YES,"37.53024267, -122.33012036",Industrial,10-50,INC875,Medium
Burglary in Progress reported in Downtown,INCIDENT,10-02 - Burglary in Progress,Reported burglary in progress at location. Additional details unknown.,37.52542498,-122.32809393,,,,50 ft,YES,YES,"37.52542498, -122.32809393",Downtown,10-02,INC876,High
Attempted Suicide reported in Downtown,INCIDENT,10-31 - Attempted Suicide,Reported attempted suicide at location. Additional details unknown.,37.53760956,-122.32926322,,,,50 ft,YES,YES,"37.53760956, -122.32926322",Downtown,10-31,INC877,Critical
Illegal Dumping reported in Rural,INCIDENT,10-24 - Illegal Dumping,Reported illegal dumping at location. Additional details unknown.,37.53556974,-122.32919768,,,,50 ft,YES,YES,"37.53556974, -122.32919768",Rural,10-24,INC878,Low
Domestic Dispute reported in Downtown,INCIDENT,10-19 - Domestic Dispute,Reported domestic dispute at location. Additional details unknown.,37.52008918,-122.32227594,,,,50 ft,YES,YES,"37.52008918, -122.32227594",Downtown,10-19,INC879,High
Structure Fire reported in Seaside,INCIDENT,10-07 - Structure Fire,Reported structure fire at location. Additional details unknown.,37.52282199,-122.33044838,,,,50 ft,YES,YES,"37.52282199, -122.33044838",Seaside,10-07,INC880,Critical
Armed Robbery reported in Downtown,INCIDENT,10-03 - Armed Robbery,Reported armed robbery at location. Additional details unknown.,37.53893395,-122.32059831,,,,50 ft,YES,YES,"37.53893395, -122.32059831",Downtown,10-03,INC881,Low
Illegal Dumping reported in Central,INCIDENT,10-24 - Illegal Dumping,Reported illegal dumping at location. Additional details unknown.,37.52037082,-122.32936297,,,,50 ft,YES,YES,"37.52037082, -122.32936297",Central,10-24,INC882,Critical
Hostage Situation reported in Uptown,INCIDENT,10-05 - Hostage Situation,Reported hostage situation at location. Additional details unknown.,37.53750861,-122.33504985,,,,50 ft,YES,YES,"37.53750861, -122.33504985",Uptown,10-05,INC883,Medium
Drug Activity Reported reported in Suburban,INCIDENT,10-11 - Drug Activity Reported,Reported drug activity reported at location. Additional details unknown.,37.53144471,-122.33319802,,,,50 ft,YES,YES,"37.53144471, -122.33319802",Suburban,10-11,INC884,Low
Chemical Spill reported in Seaside,INCIDENT,10-35 - Chemical Spill,Reported chemical spill at location. Additional details unknown.,37.53293233,-122.33446975,,,,50 ft,YES,YES,"37.53293233, -122.33446975",Seaside,10-35,INC885,Low
Collapsed Building reported in Downtown,INCIDENT,10-48 - Collapsed Building,Reported collapsed building at location. Additional details unknown.,37.53230876,-122.32314293,,,,50 ft,YES,YES,"37.53230876, -122.32314293",Downtown,10-48,INC886,Medium
Street Racing Incident reported in Industrial,INCIDENT,10-17 - Street Racing Incident,Reported street racing incident at location. Additional details unknown.,37.53954789,-122.32700412,,,,50 ft,YES,YES,"37.53954789, -122.32700412",Industrial,10-17,INC887,Low
Structure Fire reported in Uptown,INCIDENT,10-07 - Structure Fire,Reported structure fire at location. Additional details unknown.,37.52459318,-122.33252345,,,,50 ft,YES,YES,"37.52459318, -122.33252345",Uptown,10-07,INC888,High
Cyber Crime reported in Downtown,INCIDENT,10-32 - Cyber Crime,Reported cyber crime at location. Additional details unknown.,37.52999617,-122.33720466,,,,50 ft,YES,YES,"37.52999617, -122.33720466",Downtown,10-32,INC889,Medium
Mudslide Reported reported in Seaside,INCIDENT,10-38 - Mudslide Reported,Reported mudslide reported at location. Additional details unknown.,37.53092061,-122.32164815,,,,50 ft,YES,YES,"37.53092061, -122.32164815",Seaside,10-38,INC890,High
Hit-and-Run Accident reported in Uptown,INCIDENT,10-23 - Hit-and-Run Accident,Reported hit-and-run accident at location. Additional details unknown.,37.52656926,-122.33898607,,,,50 ft,YES,YES,"37.52656926, -122.33898607",Uptown,10-23,INC891,Low
Medical Emergency - Minor reported in Rural,INCIDENT,10-10 - Medical Emergency - Minor,Reported medical emergency - minor at location. Additional details unknown.,37.52307515,-122.32052492,,,,50 ft,YES,YES,"37.52307515, -122.32052492",Rural,10-10,INC892,Critical
Landslide Reported reported in Downtown,INCIDENT,10-42 - Landslide Reported,Reported landslide reported at location. Additional details unknown.,37.53181336,-122.3261747,,,,50 ft,YES,YES,"37.53181336, -122.3261747",Downtown,10-42,INC893,Low
Landslide Reported reported in Industrial,INCIDENT,10-42 - Landslide Reported,Reported landslide reported at location. Additional details unknown.,37.52405487,-122.32292924,,,,50 ft,YES,YES,"37.52405487, -122.32292924",Industrial,10-42,INC894,Low
Noise Complaint reported in Seaside,INCIDENT,10-28 - Noise Complaint,Reported noise complaint at location. Additional details unknown.,37.53682481,-122.33684243,,,,50 ft,YES,YES,"37.53682481, -122.33684243",Seaside,10-28,INC895,High
Avalanche Risk reported in Rural,INCIDENT,10-41 - Avalanche Risk,Reported avalanche risk at location. Additional details unknown.,37.53158511,-122.32409142,,,,50 ft,YES,YES,"37.53158511, -122.32409142",Rural,10-41,INC896,High
Suspicious Package reported in Seaside,INCIDENT,10-12 - Suspicious Package,Reported suspicious package at location. Additional details unknown.,37.52370578,-122.32135039,,,,50 ft,YES,YES,"37.52370578, -122.32135039",Seaside,10-12,INC897,Medium
Gunshots Heard reported in Suburban,INCIDENT,10-13 - Gunshots Heard,Reported gunshots heard at location. Additional details unknown.,37.5335794,-122.32989727,,,,50 ft,YES,YES,"37.5335794, -122.32989727",Suburban,10-13,INC898,High
Chemical Spill reported in Industrial,INCIDENT,10-35 - Chemical Spill,Reported chemical spill at location. Additional details unknown.,37.52420905,-122.33701123,,,,50 ft,YES,YES,"37.52420905, -122.33701123",Industrial,10-35,INC899,Critical
Sinkhole Formation reported in Suburban,INCIDENT,10-44 - Sinkhole Formation,Reported sinkhole formation at location. Additional details unknown.,37.5205352,-122.32232394,,,,50 ft,YES,YES,"37.5205352, -122.32232394",Suburban,10-44,INC900,Critical
Collapsed Building reported in Uptown,INCIDENT,10-48 - Collapsed Building,Reported collapsed building at location. Additional details unknown.,37.53504333,-122.32582638,,,,50 ft,YES,YES,"37.53504333, -122.32582638",Uptown,10-48,INC901,High
Drowning Incident reported in Industrial,INCIDENT,10-47 - Drowning Incident,Reported drowning incident at location. Additional details unknown.,37.52171837,-122.32184979,,,,50 ft,YES,YES,"37.52171837, -122.32184979",Industrial,10-47,INC902,Low
Suspicious Package reported in Seaside,INCIDENT,10-12 - Suspicious Package,Reported suspicious package at location. Additional details unknown.,37.53266532,-122.33316111,,,,50 ft,YES,YES,"37.53266532, -122.33316111",Seaside,10-12,INC903,Critical
Severe Weather Alert reported in Downtown,INCIDENT,10-43 - Severe Weather Alert,Reported severe weather alert at location. Additional details unknown.,37.52366167,-122.3388775,,,,50 ft,YES,YES,"37.52366167, -122.3388775",Downtown,10-43,INC904,Medium
Flooding Reported reported in Central,INCIDENT,10-40 - Flooding Reported,Reported flooding reported at location. Additional details unknown.,37.53216169,-122.32817243,,,,50 ft,YES,YES,"37.53216169, -122.32817243",Central,10-40,INC905,Critical
Structure Fire reported in Industrial,INCIDENT,10-07 - Structure Fire,Reported structure fire at location. Additional details unknown.,37.5357364,-122.32251599,,,,50 ft,YES,YES,"37.5357364, -122.32251599",Industrial,10-07,INC906,High
Attempted Kidnapping reported in Rural,INCIDENT,10-15 - Attempted Kidnapping,Reported attempted kidnapping at location. Additional details unknown.,37.5336149,-122.32777532,,,,50 ft,YES,YES,"37.5336149, -122.32777532",Rural,10-15,INC907,Critical
Vandalism in Progress reported in Central,INCIDENT,10-14 - Vandalism in Progress,Reported vandalism in progress at location. Additional details unknown.,37.53281474,-122.33013811,,,,50 ft,YES,YES,"37.53281474, -122.33013811",Central,10-14,INC908,Medium
Explosion Reported reported in Downtown,INCIDENT,10-06 - Explosion Reported,Reported explosion reported at location. Additional details unknown.,37.53183896,-122.33166718,,,,50 ft,YES,YES,"37.53183896, -122.33166718",Downtown,10-06,INC909,Low
Landslide Reported reported in Central,INCIDENT,10-42 - Landslide Reported,Reported landslide reported at location. Additional details unknown.,37.52109571,-122.32795864,,,,50 ft,YES,YES,"37.52109571, -122.32795864",Central,10-42,INC910,Medium
Noise Complaint reported in Central,INCIDENT,10-28 - Noise Complaint,Reported noise complaint at location. Additional details unknown.,37.52966634,-122.33885393,,,,50 ft,YES,YES,"37.52966634, -122.33885393",Central,10-28,INC911,Critical
Medical Emergency - Minor reported in Industrial,INCIDENT,10-10 - Medical Emergency - Minor,Reported medical emergency - minor at location. Additional details unknown.,37.53734265,-122.33119249,,,,50 ft,YES,YES,"37.53734265, -122.33119249",Industrial,10-10,INC912,Critical
Street Racing Incident reported in Rural,INCIDENT,10-17 - Street Racing Incident,Reported street racing incident at location. Additional details unknown.,37.53439718,-122.32140498,,,,50 ft,YES,YES,"37.53439718, -122.32140498",Rural,10-17,INC913,Low
Drug Activity Reported reported in Rural,INCIDENT,10-11 - Drug Activity Reported,Reported drug activity reported at location. Additional details unknown.,37.53531008,-122.33121923,,,,50 ft,YES,YES,"37.53531008, -122.33121923",Rural,10-11,INC914,Critical
Radiation Alert reported in Central,INCIDENT,10-36 - Radiation Alert,Reported radiation alert at location. Additional details unknown.,37.53185031,-122.33874683,,,,50 ft,YES,YES,"37.53185031, -122.33874683",Central,10-36,INC915,Medium
Wildfire Spotted reported in Suburban,INCIDENT,10-46 - Wildfire Spotted,Reported wildfire spotted at location. Additional details unknown.,37.53050268,-122.3311631,,,,50 ft,YES,YES,"37.53050268, -122.3311631",Suburban,10-46,INC916,High
Armed Robbery reported in Suburban,INCIDENT,10-03 - Armed Robbery,Reported armed robbery at location. Additional details unknown.,37.53934537,-122.32936727,,,,50 ft,YES,YES,"37.53934537, -122.32936727",Suburban,10-03,INC917,Medium
Cyber Crime reported in Suburban,INCIDENT,10-32 - Cyber Crime,Reported cyber crime at location. Additional details unknown.,37.52137955,-122.3316854,,,,50 ft,YES,YES,"37.52137955, -122.3316854",Suburban,10-32,INC918,Medium
Explosion Reported reported in Industrial,INCIDENT,10-06 - Explosion Reported,Reported explosion reported at location. Additional details unknown.,37.52948168,-122.33327052,,,,50 ft,YES,YES,"37.52948168, -122.33327052",Industrial,10-06,INC919,Medium
Public Intoxication reported in Rural,INCIDENT,10-25 - Public Intoxication,Reported public intoxication at location. Additional details unknown.,37.52623996,-122.33428716,,,,50 ft,YES,YES,"37.52623996, -122.33428716",Rural,10-25,INC920,Medium
Tornado Warning reported in Downtown,INCIDENT,10-39 - Tornado Warning,Reported tornado warning at location. Additional details unknown.,37.53234679,-122.3286202,,,,50 ft,YES,YES,"37.53234679, -122.3286202",Downtown,10-39,INC921,High
Chemical Spill reported in Suburban,INCIDENT,10-35 - Chemical Spill,Reported chemical spill at location. Additional details unknown.,37.52654457,-122.33465124,,,,50 ft,YES,YES,"37.52654457, -122.33465124",Suburban,10-35,INC922,Medium
Chemical Spill reported in Downtown,INCIDENT,10-35 - Chemical Spill,Reported chemical spill at location. Additional details unknown.,37.5225288,-122.32181882,,,,50 ft,YES,YES,"37.5225288, -122.32181882",Downtown,10-35,INC923,Critical
Tornado Warning reported in Downtown,INCIDENT,10-39 - Tornado Warning,Reported tornado warning at location. Additional details unknown.,37.52608398,-122.32490452,,,,50 ft,YES,YES,"37.52608398, -122.32490452",Downtown,10-39,INC924,High
Animal Attack reported in Suburban,INCIDENT,10-20 - Animal Attack,Reported animal attack at location. Additional details unknown.,37.53397663,-122.32913363,,,,50 ft,YES,YES,"37.53397663, -122.32913363",Suburban,10-20,INC925,Low
Road Hazard reported in Industrial,INCIDENT,10-21 - Road Hazard,Reported road hazard at location. Additional details unknown.,37.53239113,-122.32304295,,,,50 ft,YES,YES,"37.53239113, -122.32304295",Industrial,10-21,INC926,Critical
Wildfire Spotted reported in Suburban,INCIDENT,10-46 - Wildfire Spotted,Reported wildfire spotted at location. Additional details unknown.,37.52726414,-122.33761311,,,,50 ft,YES,YES,"37.52726414, -122.33761311",Suburban,10-46,INC927,Medium
Flooding Reported reported in Industrial,INCIDENT,10-40 - Flooding Reported,Reported flooding reported at location. Additional details unknown.,37.52055412,-122.33242694,,,,50 ft,YES,YES,"37.52055412, -122.33242694",Industrial,10-40,INC928,Medium
Noise Complaint reported in Downtown,INCIDENT,10-28 - Noise Complaint,Reported noise complaint at location. Additional details unknown.,37.52297229,-122.32552838,,,,50 ft,YES,YES,"37.52297229, -122.32552838",Downtown,10-28,INC929,Critical
Armed Robbery reported in Rural,INCIDENT,10-03 - Armed Robbery,Reported armed robbery at location. Additional details unknown.,37.53565238,-122.32944896,,,,50 ft,YES,YES,"37.53565238, -122.32944896",Rural,10-03,INC930,Medium
Underage Drinking reported in Rural,INCIDENT,10-29 - Underage Drinking,Reported underage drinking at location. Additional details unknown.,37.53221725,-122.33041018,,,,50 ft,YES,YES,"37.53221725, -122.33041018",Rural,10-29,INC931,High
Hostage Situation reported in Industrial,INCIDENT,10-05 - Hostage Situation,Reported hostage situation at location. Additional details unknown.,37.52356448,-122.33676088,,,,50 ft,YES,YES,"37.52356448, -122.33676088",Industrial,10-05,INC932,Medium
Road Hazard reported in Central,INCIDENT,10-21 - Road Hazard,Reported road hazard at location. Additional details unknown.,37.52939972,-122.32116666,,,,50 ft,YES,YES,"37.52939972, -122.32116666",Central,10-21,INC933,High
